{
  "schema_version": "1.0",
  "render_id": "204647e324000c5c",
  "raw_pdf_sha256": "7c62227febe3fb1c8ffcc24d1866710fd8d560c574d161f84e650055b2f6037a",
  "structural_hash": "2222222222222222222222222222222222222222222222222222222222222222",
  "renderer": {"name": "LibreOffice", "version": "24.2", "image_digest": "sha256:3333333333333333333333333333333333333333333333333333333333333333"},
  "font_manifest_hash": "59abb477289d0e0a26eb1c8dd367aad8a0092cc41e41aeb4a66ec4d1ae03a2ee",
  "locale": "zh-CN",
  "page_dimensions": {"width_pt": 595.276, "height_pt": 841.89},
  "named_destinations": [
    {"name": "chapter-1", "page": 1, "x_pt": 72, "y_pt": 769.89}
  ],
  "extracted_text_hash": "5555555555555555555555555555555555555555555555555555555555555555",
  "font_manifest": [
    {"postscript_name": "NotoSerifCJKsc-Regular", "family": "Noto Serif CJK SC", "style": "Regular", "embedded": true, "subset": true, "file_sha256": "6666666666666666666666666666666666666666666666666666666666666666"}
  ],
  "pages": [
    {"page": 1, "width_pt": 595.276, "height_pt": 841.89, "perceptual_hash": "0123456789abcdef"},
    {"page": 2, "width_pt": 595.276, "height_pt": 841.89, "perceptual_hash": "fedcba9876543210"}
  ]
}
